{
  "$schema": "https://json-schema.org/draft/2020-12/schema",
  "$id": "https://schemas.kumwe.org/studio/v1/binding-projection-vector.schema.json",
  "title": "Studio field-binding projection conformance vector",
  "description": "One complete Blueprint, exact host-projected content model, locked block definitions, and the normalized field-binding affordances and diagnostics every implementation must reproduce.",
  "type": "object",
  "additionalProperties": false,
  "required": [
    "contractVersion",
    "kind",
    "id",
    "description",
    "profile",
    "blueprint",
    "model",
    "blockDefinitions",
    "expect"
  ],
  "properties": {
    "contractVersion": { "$ref": "common.schema.json#/$defs/contractVersion" },
    "kind": { "const": "binding-projection-vector" },
    "id": { "$ref": "common.schema.json#/$defs/stableId" },
    "description": { "type": "string", "minLength": 1, "maxLength": 1000 },
    "profile": { "const": "studio.profile/binding-projection-v1" },
    "blueprint": { "$ref": "blueprint.schema.json" },
    "model": { "$ref": "content-model.schema.json" },
    "blockDefinitions": {
      "type": "array",
      "minItems": 1,
      "maxItems": 1000,
      "items": { "$ref": "block-definition.schema.json" }
    },
    "expect": { "$ref": "#/$defs/projection" }
  },
  "$defs": {
    "fieldPath": {
      "type": "array",
      "minItems": 1,
      "maxItems": 32,
      "items": { "$ref": "common.schema.json#/$defs/localName" }
    },
    "candidate": {
      "type": "object",
      "additionalProperties": false,
      "required": ["fieldPath", "kind", "cardinality"],
      "properties": {
        "fieldPath": { "$ref": "#/$defs/fieldPath" },
        "kind": {
          "$ref": "content-model.schema.json#/$defs/field/properties/kind"
        },
        "itemKind": {
          "$ref": "content-model.schema.json#/$defs/field/properties/itemKind"
        },
        "cardinality": { "enum": ["one", "many"] },
        "control": { "$ref": "common.schema.json#/$defs/qualifiedName" }
      }
    },
    "port": {
      "type": "object",
      "additionalProperties": false,
      "required": ["port", "status", "candidates"],
      "properties": {
        "port": { "$ref": "common.schema.json#/$defs/localName" },
        "status": { "enum": ["invalid", "non-field-source", "resolved", "unbound"] },
        "bindingSourceKind": {
          "enum": [
            "context-value",
            "entry-field",
            "query-reference",
            "resource-reference",
            "static-value"
          ]
        },
        "boundFieldPath": { "$ref": "#/$defs/fieldPath" },
        "candidates": {
          "type": "array",
          "maxItems": 1000,
          "items": { "$ref": "#/$defs/candidate" }
        },
        "multiple": { "type": "boolean" },
        "required": { "type": "boolean" },
        "valueType": { "type": "string", "minLength": 1, "maxLength": 200 }
      }
    },
    "node": {
      "type": "object",
      "additionalProperties": false,
      "required": ["nodeId", "ports"],
      "properties": {
        "nodeId": { "$ref": "common.schema.json#/$defs/stableId" },
        "ports": {
          "type": "array",
          "maxItems": 100,
          "items": { "$ref": "#/$defs/port" }
        }
      }
    },
    "diagnostic": {
      "type": "object",
      "additionalProperties": false,
      "required": ["code", "severity"],
      "properties": {
        "code": { "$ref": "common.schema.json#/$defs/qualifiedName" },
        "severity": { "enum": ["information", "warning", "error", "blocking"] },
        "location": { "$ref": "common.schema.json#/$defs/diagnosticLocation" }
      }
    },
    "projection": {
      "type": "object",
      "additionalProperties": false,
      "required": ["model", "nodes", "diagnostics"],
      "properties": {
        "model": { "$ref": "common.schema.json#/$defs/lockedArtifactReference" },
        "nodes": {
          "type": "array",
          "maxItems": 100000,
          "items": { "$ref": "#/$defs/node" }
        },
        "diagnostics": {
          "type": "array",
          "maxItems": 100000,
          "items": { "$ref": "#/$defs/diagnostic" }
        }
      }
    }
  }
}
