{
  "contractVersion": "0.1-draft",
  "kind": "binding-projection-vector",
  "id": "binding-projection/app-content-fields-resolved",
  "description": "An App-like Content projection exposes compatible visible fields in authoring order, preserves declared controls, and resolves exact entry-field bindings.",
  "profile": "studio.profile/binding-projection-v1",
  "blueprint": {
    "contractVersion": "0.1-draft",
    "kind": "blueprint",
    "id": "blueprints/article-page",
    "version": "1.0.0",
    "revision": "blueprint-r1",
    "owner": { "id": "studio.test/host", "version": "1.0.0" },
    "status": "draft",
    "label": { "key": "studio.test/article-page", "defaultMessage": "Article page" },
    "model": {
      "id": "content-model:00000000-0000-4000-8000-000000000001",
      "version": "0.0.4",
      "revision": "content-type-v4"
    },
    "dependencyLock": {
      "theme": { "id": "studio.test/theme", "version": "1.0.0", "revision": "theme-r1" },
      "blocks": [{ "type": "studio.test/article-card", "version": "1.0.0", "revision": "block-r1" }]
    },
    "roots": [
      {
        "id": "article-card-1",
        "type": "studio.test/article-card",
        "version": "1.0.0",
        "properties": {},
        "bindings": {
          "headline": {
            "source": { "kind": "entry-field", "fieldPath": ["data_title"] },
            "transforms": [],
            "onNull": "empty",
            "onError": "error"
          },
          "labels": {
            "source": { "kind": "entry-field", "fieldPath": ["data_tags"] },
            "transforms": [],
            "onNull": "empty",
            "onError": "error"
          },
          "manual": {
            "source": { "kind": "static-value", "value": "Fallback" },
            "transforms": [],
            "onNull": "empty",
            "onError": "error"
          }
        },
        "slots": {},
        "authoring": { "mode": "content" }
      }
    ]
  },
  "model": {
    "contractVersion": "0.1-draft",
    "kind": "content-model",
    "id": "content-model:00000000-0000-4000-8000-000000000001",
    "version": "0.0.4",
    "revision": "content-type-v4",
    "owner": { "id": "kumwe.app/content", "version": "2.0.0" },
    "status": "published",
    "label": { "key": "kumwe.app/article", "defaultMessage": "Article" },
    "fields": [
      {
        "id": "data_title",
        "kind": "string",
        "label": { "key": "kumwe.app/title", "defaultMessage": "Title" },
        "required": true,
        "localized": true,
        "cardinality": "one",
        "authoring": { "control": "studio.control/single-line-text", "order": 0 }
      },
      {
        "id": "data_contact",
        "kind": "string",
        "label": { "key": "kumwe.app/contact", "defaultMessage": "Contact" },
        "required": false,
        "localized": true,
        "cardinality": "one",
        "authoring": { "control": "kumwe.app/email", "order": 1 }
      },
      {
        "id": "data_category",
        "kind": "enum",
        "label": { "key": "kumwe.app/category", "defaultMessage": "Category" },
        "required": false,
        "localized": true,
        "cardinality": "one",
        "enumValues": [
          {
            "value": "guide",
            "label": { "key": "kumwe.app/category-guide", "defaultMessage": "Guide" }
          }
        ],
        "authoring": { "control": "studio.control/select", "order": 2 }
      },
      {
        "id": "data_internal",
        "kind": "string",
        "label": { "key": "kumwe.app/internal", "defaultMessage": "Internal" },
        "required": false,
        "localized": false,
        "cardinality": "one",
        "authoring": {
          "control": "studio.control/single-line-text",
          "hidden": true,
          "order": 3
        }
      },
      {
        "id": "data_tags",
        "kind": "collection",
        "itemKind": "string",
        "label": { "key": "kumwe.app/tags", "defaultMessage": "Tags" },
        "required": false,
        "localized": true,
        "cardinality": "many",
        "authoring": { "control": "kumwe.app/schema-group", "order": 4 }
      }
    ],
    "relationships": []
  },
  "blockDefinitions": [
    {
      "contractVersion": "0.1-draft",
      "kind": "block-definition",
      "type": "studio.test/article-card",
      "version": "1.0.0",
      "revision": "block-r1",
      "owner": { "id": "studio.test/blocks", "version": "1.0.0" },
      "label": { "key": "studio.test/article-card", "defaultMessage": "Article card" },
      "category": "studio.category/content",
      "propertySchema": { "type": "object", "additionalProperties": false },
      "slots": [],
      "ports": [
        {
          "id": "headline",
          "label": { "key": "studio.test/headline", "defaultMessage": "Headline" },
          "valueType": "text",
          "required": true,
          "multiple": false
        },
        {
          "id": "labels",
          "label": { "key": "studio.test/labels", "defaultMessage": "Labels" },
          "valueType": "text",
          "required": false,
          "multiple": true
        },
        {
          "id": "featured",
          "label": { "key": "studio.test/featured", "defaultMessage": "Featured" },
          "valueType": "boolean",
          "required": false,
          "multiple": false
        },
        {
          "id": "manual",
          "label": { "key": "studio.test/manual", "defaultMessage": "Manual" },
          "valueType": "text",
          "required": false,
          "multiple": false
        }
      ],
      "editingModes": ["blueprint", "content"],
      "themeControls": [],
      "rendererRequirements": [
        {
          "surface": "preview",
          "capability": "studio.renderer/test",
          "versions": "^1.0.0"
        }
      ],
      "accessibility": {
        "category": "text",
        "accessibleName": "derived",
        "keyboard": {
          "key": "studio.test/article-card-keyboard",
          "defaultMessage": "Use the outline controls."
        },
        "reducedMotion": "not-applicable",
        "outputChecks": ["studio.check/article-card"]
      }
    }
  ],
  "expect": {
    "model": {
      "id": "content-model:00000000-0000-4000-8000-000000000001",
      "version": "0.0.4",
      "revision": "content-type-v4"
    },
    "nodes": [
      {
        "nodeId": "article-card-1",
        "ports": [
          {
            "port": "headline",
            "status": "resolved",
            "bindingSourceKind": "entry-field",
            "boundFieldPath": ["data_title"],
            "candidates": [
              {
                "fieldPath": ["data_title"],
                "kind": "string",
                "cardinality": "one",
                "control": "studio.control/single-line-text"
              },
              {
                "fieldPath": ["data_contact"],
                "kind": "string",
                "cardinality": "one",
                "control": "kumwe.app/email"
              },
              {
                "fieldPath": ["data_category"],
                "kind": "enum",
                "cardinality": "one",
                "control": "studio.control/select"
              }
            ],
            "multiple": false,
            "required": true,
            "valueType": "text"
          },
          {
            "port": "labels",
            "status": "resolved",
            "bindingSourceKind": "entry-field",
            "boundFieldPath": ["data_tags"],
            "candidates": [
              {
                "fieldPath": ["data_tags"],
                "kind": "collection",
                "itemKind": "string",
                "cardinality": "many",
                "control": "kumwe.app/schema-group"
              }
            ],
            "multiple": true,
            "required": false,
            "valueType": "text"
          },
          {
            "port": "featured",
            "status": "unbound",
            "candidates": [],
            "multiple": false,
            "required": false,
            "valueType": "boolean"
          },
          {
            "port": "manual",
            "status": "non-field-source",
            "bindingSourceKind": "static-value",
            "candidates": [
              {
                "fieldPath": ["data_title"],
                "kind": "string",
                "cardinality": "one",
                "control": "studio.control/single-line-text"
              },
              {
                "fieldPath": ["data_contact"],
                "kind": "string",
                "cardinality": "one",
                "control": "kumwe.app/email"
              },
              {
                "fieldPath": ["data_category"],
                "kind": "enum",
                "cardinality": "one",
                "control": "studio.control/select"
              }
            ],
            "multiple": false,
            "required": false,
            "valueType": "text"
          }
        ]
      }
    ],
    "diagnostics": []
  }
}
