{
  "contractVersion": "0.1-draft",
  "kind": "binding-projection-vector",
  "id": "binding-projection/field-removed-diagnostic",
  "description": "A binding to a field removed from the exact locked model is preserved and diagnosed instead of silently rewritten.",
  "profile": "studio.profile/binding-projection-v1",
  "blueprint": {
    "contractVersion": "0.1-draft",
    "kind": "blueprint",
    "id": "blueprints/removed-field",
    "version": "1.0.0",
    "revision": "blueprint-r1",
    "owner": { "id": "studio.test/host", "version": "1.0.0" },
    "status": "draft",
    "label": { "key": "studio.test/removed-field", "defaultMessage": "Removed field" },
    "model": { "id": "studio.test/article", "version": "1.0.0", "revision": "model-r2" },
    "dependencyLock": {
      "theme": { "id": "studio.test/theme", "version": "1.0.0", "revision": "theme-r1" },
      "blocks": [{ "type": "studio.test/text", "version": "1.0.0", "revision": "block-r1" }]
    },
    "roots": [
      {
        "id": "text-1",
        "type": "studio.test/text",
        "version": "1.0.0",
        "properties": {},
        "bindings": {
          "headline": {
            "source": { "kind": "entry-field", "fieldPath": ["title"] },
            "transforms": [],
            "onNull": "empty",
            "onError": "error"
          }
        },
        "slots": {},
        "authoring": { "mode": "content" }
      }
    ]
  },
  "model": {
    "contractVersion": "0.1-draft",
    "kind": "content-model",
    "id": "studio.test/article",
    "version": "1.0.0",
    "revision": "model-r2",
    "owner": { "id": "studio.test/host", "version": "1.0.0" },
    "status": "published",
    "label": { "key": "studio.test/article", "defaultMessage": "Article" },
    "fields": [
      {
        "id": "summary",
        "kind": "string",
        "label": { "key": "studio.test/summary", "defaultMessage": "Summary" },
        "required": false,
        "localized": true,
        "cardinality": "one",
        "authoring": { "control": "studio.control/multi-line-text", "order": 0 }
      }
    ],
    "relationships": []
  },
  "blockDefinitions": [
    {
      "contractVersion": "0.1-draft",
      "kind": "block-definition",
      "type": "studio.test/text",
      "version": "1.0.0",
      "revision": "block-r1",
      "owner": { "id": "studio.test/blocks", "version": "1.0.0" },
      "label": { "key": "studio.test/text", "defaultMessage": "Text" },
      "category": "studio.category/content",
      "propertySchema": { "type": "object", "additionalProperties": false },
      "slots": [],
      "ports": [
        {
          "id": "headline",
          "label": { "key": "studio.test/headline", "defaultMessage": "Headline" },
          "valueType": "text",
          "required": true,
          "multiple": false
        }
      ],
      "editingModes": ["blueprint", "content"],
      "themeControls": [],
      "rendererRequirements": [
        { "surface": "preview", "capability": "studio.renderer/test", "versions": "^1.0.0" }
      ],
      "accessibility": {
        "category": "text",
        "accessibleName": "derived",
        "keyboard": { "key": "studio.test/text-keyboard", "defaultMessage": "Use the outline." },
        "reducedMotion": "not-applicable",
        "outputChecks": ["studio.check/text"]
      }
    }
  ],
  "expect": {
    "model": { "id": "studio.test/article", "version": "1.0.0", "revision": "model-r2" },
    "nodes": [
      {
        "nodeId": "text-1",
        "ports": [
          {
            "port": "headline",
            "status": "invalid",
            "bindingSourceKind": "entry-field",
            "boundFieldPath": ["title"],
            "candidates": [
              {
                "fieldPath": ["summary"],
                "kind": "string",
                "cardinality": "one",
                "control": "studio.control/multi-line-text"
              }
            ],
            "multiple": false,
            "required": true,
            "valueType": "text"
          }
        ]
      }
    ],
    "diagnostics": [
      {
        "code": "studio.binding/field-missing",
        "severity": "error",
        "location": {
          "artifactId": "blueprints/removed-field",
          "nodeId": "text-1",
          "fieldPath": ["title"]
        }
      }
    ]
  }
}
