{
  "contractVersion": "0.1-draft",
  "kind": "binding-projection-vector",
  "id": "binding-projection/model-revision-mismatch-diagnostic",
  "description": "A projected model from a different immutable revision fails the entire candidate surface closed with an exact coordinate diagnostic.",
  "profile": "studio.profile/binding-projection-v1",
  "blueprint": {
    "contractVersion": "0.1-draft",
    "kind": "blueprint",
    "id": "blueprints/revision-mismatch",
    "version": "1.0.0",
    "revision": "blueprint-r1",
    "owner": { "id": "studio.test/host", "version": "1.0.0" },
    "status": "draft",
    "label": { "key": "studio.test/revision-mismatch", "defaultMessage": "Mismatch" },
    "model": { "id": "studio.test/article", "version": "1.0.0", "revision": "model-r1" },
    "dependencyLock": {
      "theme": { "id": "studio.test/theme", "version": "1.0.0", "revision": "theme-r1" },
      "blocks": [{ "type": "studio.test/text", "version": "1.0.0", "revision": "block-r1" }]
    },
    "roots": [
      {
        "id": "text-1",
        "type": "studio.test/text",
        "version": "1.0.0",
        "properties": {},
        "bindings": {
          "headline": {
            "source": { "kind": "entry-field", "fieldPath": ["title"] },
            "transforms": [],
            "onNull": "empty",
            "onError": "error"
          }
        },
        "slots": {},
        "authoring": { "mode": "content" }
      }
    ]
  },
  "model": {
    "contractVersion": "0.1-draft",
    "kind": "content-model",
    "id": "studio.test/article",
    "version": "1.0.0",
    "revision": "model-r2",
    "owner": { "id": "studio.test/host", "version": "1.0.0" },
    "status": "published",
    "label": { "key": "studio.test/article", "defaultMessage": "Article" },
    "fields": [
      {
        "id": "title",
        "kind": "string",
        "label": { "key": "studio.test/title", "defaultMessage": "Title" },
        "required": true,
        "localized": true,
        "cardinality": "one",
        "authoring": { "control": "studio.control/single-line-text", "order": 0 }
      }
    ],
    "relationships": []
  },
  "blockDefinitions": [
    {
      "contractVersion": "0.1-draft",
      "kind": "block-definition",
      "type": "studio.test/text",
      "version": "1.0.0",
      "revision": "block-r1",
      "owner": { "id": "studio.test/blocks", "version": "1.0.0" },
      "label": { "key": "studio.test/text", "defaultMessage": "Text" },
      "category": "studio.category/content",
      "propertySchema": { "type": "object", "additionalProperties": false },
      "slots": [],
      "ports": [
        {
          "id": "headline",
          "label": { "key": "studio.test/headline", "defaultMessage": "Headline" },
          "valueType": "text",
          "required": true,
          "multiple": false
        }
      ],
      "editingModes": ["blueprint", "content"],
      "themeControls": [],
      "rendererRequirements": [
        { "surface": "preview", "capability": "studio.renderer/test", "versions": "^1.0.0" }
      ],
      "accessibility": {
        "category": "text",
        "accessibleName": "derived",
        "keyboard": { "key": "studio.test/text-keyboard", "defaultMessage": "Use the outline." },
        "reducedMotion": "not-applicable",
        "outputChecks": ["studio.check/text"]
      }
    }
  ],
  "expect": {
    "model": { "id": "studio.test/article", "version": "1.0.0", "revision": "model-r1" },
    "nodes": [
      {
        "nodeId": "text-1",
        "ports": [
          {
            "port": "headline",
            "status": "invalid",
            "bindingSourceKind": "entry-field",
            "boundFieldPath": ["title"],
            "candidates": [],
            "multiple": false,
            "required": true,
            "valueType": "text"
          }
        ]
      }
    ],
    "diagnostics": [
      {
        "code": "studio.binding/model-revision-mismatch",
        "severity": "error",
        "location": { "artifactId": "blueprints/revision-mismatch" }
      }
    ]
  }
}
